{
  "name": "Barbarian",
  "description": "Barbarians are mighty warriors who are powered by primal forces of the multiverse that manifest as a Rage. More than a mere emotion—and not limited to anger—this Rage is an incarnation of a predator's ferocity, a storm's fury, and a sea's turmoil. Some Barbarians personify their Rage as a fierce spirit or revered forebear. Others see it as a connection to the pain and anguish of the world, as an impersonal tangle of wild magic, or as an expression of their own deepest self. For every Barbarian, their Rage is a power that fuels not just battle prowess, but also uncanny reflexes and heightened senses.",
  "primaryAbility": ["Strength"],
  "hitPointDie": "D12",
  "proficiencies": {
    "savingThrows": ["Strength", "Constitution"],
    "skills": {
      "choose": 2,
      "from": ["Animal Handling", "Athletics", "Intimidation", "Nature", "Perception", "Survival"]
    },
    "weapons": ["Simple weapons", "Martial weapons"],
    "armor": ["Light armor", "Medium armor", "Shields"]
  },
  "startingEquipment": {
    "options": [
      {
        "choice": "A",
        "items": ["Greataxe", "4 Handaxes", "Explorer's Pack"],
        "gold": 15
      },
      {
        "choice": "B",
        "items": [],
        "gold": 75
      }
    ]
  },
  "classFeatures": {
    "1": {
      "proficiencyBonus": 2,
      "features": [
        {
          "name": "Rage",
          "description": "You can imbue yourself with a primal power called Rage, a force that grants you extraordinary might and resilience. You can enter it as a Bonus Action if you aren't wearing Heavy armor. While active, you have Resistance to Bludgeoning, Piercing, and Slashing damage, gain a bonus to damage when you make an attack using Strength, have Advantage on Strength checks and Strength saving throws, and can't maintain Concentration or cast spells.",
          "type": "feature"
        },
        {
          "name": "Unarmored Defense",
          "description": "While you aren't wearing any armor, your base Armor Class equals 10 plus your Dexterity and Constitution modifiers. You can use a Shield and still gain this benefit.",
          "type": "feature"
        },
        {
          "name": "Weapon Mastery",
          "description": "Your training with weapons allows you to use the mastery properties of two kinds of Simple or Martial Melee weapons of your choice. Whenever you finish a Long Rest, you can practice weapon drills and change one of those weapon choices.",
          "type": "feature"
        }
      ],
      "additionalData": {
        "rages": 2,
        "rageDamage": 2,
        "weaponMastery": 2
      }
    },
    "2": {
      "proficiencyBonus": 2,
      "features": [
        {
          "name": "Danger Sense",
          "description": "You gain an uncanny sense of when things aren't as they should be, giving you an edge when you dodge perils. You have Advantage on Dexterity saving throws unless you have the Incapacitated condition.",
          "type": "feature"
        },
        {
          "name": "Reckless Attack",
          "description": "You can throw aside all concern for defense to attack with increased ferocity. When you make your first attack roll on your turn, you can decide to attack recklessly. Doing so gives you Advantage on attack rolls using Strength until the start of your next turn, but attack rolls against you have Advantage during that time.",
          "type": "feature"
        }
      ],
      "additionalData": {
        "rages": 2,
        "rageDamage": 2,
        "weaponMastery": 2
      }
    },
    "3": {
      "proficiencyBonus": 2,
      "features": [
        {
          "name": "Barbarian Subclass",
          "description": "You gain a Barbarian subclass of your choice. A subclass is a specialization that grants you features at certain Barbarian levels.",
          "type": "subclass"
        },
        {
          "name": "Primal Knowledge",
          "description": "You gain proficiency in another skill of your choice from the skill list available to Barbarians at level 1. In addition, while your Rage is active, you can channel primal power when you attempt certain tasks; whenever you make an ability check using Acrobatics, Intimidation, Perception, Stealth, or Survival, you can make it as a Strength check even if it normally uses a different ability.",
          "type": "feature"
        }
      ],
      "additionalData": {
        "rages": 3,
        "rageDamage": 2,
        "weaponMastery": 2
      }
    },
    "9": {
      "proficiencyBonus": 4,
      "features": [
        {
          "name": "Brutal Strike",
          "description": "If you use Reckless Attack, you can forgo any Advantage on one Strength-based attack roll of your choice on your turn. If the chosen attack roll hits, the target takes an extra 1d10 damage of the same type dealt by the weapon or Unarmed Strike, and you can cause one Brutal Strike effect of your choice: Forceful Blow or Hamstring Blow.",
          "type": "feature"
        }
      ],
      "additionalData": {
        "rages": 4,
        "rageDamage": 3,
        "weaponMastery": 3
      }
    },
    "20": {
      "proficiencyBonus": 6,
      "features": [
        {
          "name": "Primal Champion",
          "description": "You embody primal power. Your Strength and Constitution scores increase by 4, to a maximum of 25.",
          "type": "feature"
        }
      ],
      "additionalData": {
        "rages": 6,
        "rageDamage": 4,
        "weaponMastery": 4
      }
    }
  },
  "spellcasting": {
    "type": "none"
  },
  "subclasses": [
    {
      "name": "Path of the Berserker",
      "description": "Barbarians who walk the Path of the Berserker direct their Rage primarily toward violence. Their path is one of untrammeled fury, and they thrill in the chaos of battle as they allow their Rage to seize and empower them.",
      "features": {
        "3": [
          {
            "name": "Frenzy",
            "description": "If you use Reckless Attack while your Rage is active, you deal extra damage to the first target you hit on your turn with a Strength-based attack. To determine the extra damage, roll a number of d6s equal to your Rage Damage bonus, and add them together. The damage has the same type as the weapon or Unarmed Strike used for the attack."
          }
        ],
        "6": [
          {
            "name": "Mindless Rage",
            "description": "You have Immunity to the Charmed and Frightened conditions while your Rage is active. If you're Charmed or Frightened when you enter your Rage, the condition ends on you."
          }
        ],
        "10": [
          {
            "name": "Retaliation",
            "description": "When you take damage from a creature that is within 5 feet of you, you can take a Reaction to make one melee attack against that creature, using a weapon or an Unarmed Strike."
          }
        ],
        "14": [
          {
            "name": "Intimidating Presence",
            "description": "As a Bonus Action, you can strike terror into others with your menacing presence and primal power. When you do so, each creature of your choice in a 30-foot Emanation originating from you must make a Wisdom saving throw (DC 8 plus your Strength modifier and Proficiency Bonus). On a failed save, a creature has the Frightened condition for 1 minute. Once you use this feature, you can't use it again until you finish a Long Rest unless you expend a use of your Rage (no action required) to restore your use of it."
          }
        ]
      }
    }
  ],
  "multiclassing": {
    "requirements": {
      "Strength": 13
    },
    "proficienciesGained": {
      "weapons": ["Martial weapons"],
      "armor": ["Shields"]
    }
  },
  "sourceBook": "Player's Handbook 2024"
}